{
  "alternatives": [
    "Use only one parent rule."
  ],
  "conflicts": [],
  "consequences": [
    "No parent map claims the new variant until its owner registers it."
  ],
  "constraints": [
    "Pin both exact shared-rule revisions; registrations remain pending."
  ],
  "created_at": "2026-09-23T12:20:30Z",
  "format_version": "1",
  "gaps": [],
  "grant_id": "GRANT-LIBRARY",
  "id": "REVIEW-0021",
  "instance_id": "alm.synthetic.example",
  "intent": "Combine the shared queue, pickup checklist and optional phone confirmation at Riverside.",
  "kind": "review-receipt",
  "outcome": "sufficient",
  "principal_id": "principal:library-owner",
  "read_sequence": 20,
  "reviewed": [
    {
      "record_id": "SYS-RULE-0011",
      "revision_id": "SYS-RULE-0011.r4"
    },
    {
      "record_id": "SYS-RULE-0020",
      "revision_id": "SYS-RULE-0020.r1"
    }
  ],
  "scope_id": "PROJECT-LIBRARY",
  "sources": [
    {
      "source_digest": "3a879614b166237db0f2137c0c9a8cbc1cd467411361792c9e451da236abcc23",
      "window_id": "WIN-00009"
    },
    {
      "source_digest": "3a879614b166237db0f2137c0c9a8cbc1cd467411361792c9e451da236abcc23",
      "window_id": "WIN-00015"
    }
  ]
}
