{
  "alternatives": [
    "Require every branch to use email only."
  ],
  "conflicts": [],
  "consequences": [
    "Branch choices can help members while reservations remain consistent."
  ],
  "constraints": [
    "Local contact options must still enter the shared queue."
  ],
  "created_at": "2026-09-23T12:02:30Z",
  "format_version": "1",
  "gaps": [],
  "grant_id": "GRANT-GLOBAL",
  "id": "REVIEW-0003",
  "instance_id": "alm.synthetic.example",
  "intent": "Allow branches to choose a contact method without losing the shared queue.",
  "kind": "review-receipt",
  "outcome": "sufficient",
  "principal_id": "principal:governor",
  "read_sequence": 2,
  "reviewed": [
    {
      "record_id": "SYS-RULE-0011",
      "revision_id": "SYS-RULE-0011.r2"
    }
  ],
  "scope_id": "GLOBAL",
  "sources": [
    {
      "source_digest": "3a879614b166237db0f2137c0c9a8cbc1cd467411361792c9e451da236abcc23",
      "window_id": "WIN-00002"
    }
  ]
}
