{
  "alternatives": [
    "Keep the local variation active beside the shared rule."
  ],
  "conflicts": [],
  "consequences": [
    "The branch history still explains why the option began."
  ],
  "constraints": [
    "Only the Riverside owner changes its local status."
  ],
  "created_at": "2026-09-23T12:15:30Z",
  "format_version": "1",
  "gaps": [],
  "grant_id": "GRANT-LIBRARY",
  "id": "REVIEW-0016",
  "instance_id": "alm.synthetic.example",
  "intent": "Let Riverside adopt the new shared option and retain its origin.",
  "kind": "review-receipt",
  "outcome": "sufficient",
  "principal_id": "principal:library-owner",
  "read_sequence": 15,
  "reviewed": [
    {
      "record_id": "LIB-RULE-0005",
      "revision_id": "LIB-RULE-0005.r2"
    },
    {
      "record_id": "SYS-RULE-0020",
      "revision_id": "SYS-RULE-0020.r1"
    }
  ],
  "scope_id": "PROJECT-LIBRARY",
  "sources": [
    {
      "source_digest": "3a879614b166237db0f2137c0c9a8cbc1cd467411361792c9e451da236abcc23",
      "window_id": "WIN-00008"
    },
    {
      "source_digest": "3a879614b166237db0f2137c0c9a8cbc1cd467411361792c9e451da236abcc23",
      "window_id": "WIN-00015"
    }
  ]
}
