{
  "alternatives": [
    "Leave phone confirmation as a Riverside-only variation."
  ],
  "conflicts": [],
  "consequences": [
    "Branches may adopt the option independently."
  ],
  "constraints": [
    "The global owner cannot edit Riverside's local history."
  ],
  "created_at": "2026-09-23T12:14:30Z",
  "format_version": "1",
  "gaps": [],
  "grant_id": "GRANT-GLOBAL",
  "id": "REVIEW-0015",
  "instance_id": "alm.synthetic.example",
  "intent": "Offer Riverside's phone option as a shared choice for branches.",
  "kind": "review-receipt",
  "outcome": "sufficient",
  "principal_id": "principal:governor",
  "read_sequence": 14,
  "reviewed": [
    {
      "record_id": "LIB-RULE-0005",
      "revision_id": "LIB-RULE-0005.r2"
    },
    {
      "record_id": "SYS-RULE-0011",
      "revision_id": "SYS-RULE-0011.r4"
    }
  ],
  "scope_id": "GLOBAL",
  "sources": [
    {
      "source_digest": "3a879614b166237db0f2137c0c9a8cbc1cd467411361792c9e451da236abcc23",
      "window_id": "WIN-00008"
    },
    {
      "source_digest": "3a879614b166237db0f2137c0c9a8cbc1cd467411361792c9e451da236abcc23",
      "window_id": "WIN-00009"
    }
  ]
}
