{
  "alternatives": [
    "Keep the email-only pilot."
  ],
  "conflicts": [],
  "consequences": [
    "More people can request items without volunteers promising one item twice."
  ],
  "constraints": [
    "Every phone and email request enters the same queue."
  ],
  "created_at": "2026-09-23T12:01:30Z",
  "format_version": "1",
  "gaps": [],
  "grant_id": "GRANT-GLOBAL",
  "id": "REVIEW-0002",
  "instance_id": "alm.synthetic.example",
  "intent": "Allow people without email to request items while keeping one reservation queue.",
  "kind": "review-receipt",
  "outcome": "sufficient",
  "principal_id": "principal:governor",
  "read_sequence": 1,
  "reviewed": [
    {
      "record_id": "SYS-RULE-0011",
      "revision_id": "SYS-RULE-0011.r1"
    }
  ],
  "scope_id": "GLOBAL",
  "sources": [
    {
      "source_digest": "3a879614b166237db0f2137c0c9a8cbc1cd467411361792c9e451da236abcc23",
      "window_id": "WIN-00001"
    }
  ]
}
