{
  "alternatives": [
    "Cancel the workshop permanently.",
    "Announce an unbooked date."
  ],
  "conflicts": [],
  "consequences": [
    "The workshop remains planned but no date is promised."
  ],
  "constraints": [
    "Keep the long-term goal and explain the uncertain room schedule."
  ],
  "created_at": "2026-09-23T12:04:30Z",
  "format_version": "1",
  "gaps": [],
  "grant_id": "GRANT-LIBRARY",
  "id": "REVIEW-0005",
  "instance_id": "alm.synthetic.example",
  "intent": "Delay the repair workshop until its room is confirmed.",
  "kind": "review-receipt",
  "outcome": "sufficient",
  "principal_id": "principal:library-owner",
  "read_sequence": 4,
  "reviewed": [
    {
      "record_id": "LIB-DEC-0001",
      "revision_id": "LIB-DEC-0001.r1"
    }
  ],
  "scope_id": "PROJECT-LIBRARY",
  "sources": [
    {
      "source_digest": "3a879614b166237db0f2137c0c9a8cbc1cd467411361792c9e451da236abcc23",
      "window_id": "WIN-00004"
    }
  ]
}
