{
  "alternatives": [
    "Let each branch invent its own pickup check."
  ],
  "conflicts": [],
  "consequences": [
    "Substitute volunteers can follow the same handoff steps."
  ],
  "constraints": [
    "Do not silently replace Riverside's pinned phone variation."
  ],
  "created_at": "2026-09-23T12:08:30Z",
  "format_version": "1",
  "gaps": [],
  "grant_id": "GRANT-GLOBAL",
  "id": "REVIEW-0009",
  "instance_id": "alm.synthetic.example",
  "intent": "Add one pickup checklist while keeping local contact methods.",
  "kind": "review-receipt",
  "outcome": "sufficient",
  "principal_id": "principal:governor",
  "read_sequence": 8,
  "reviewed": [
    {
      "record_id": "SYS-RULE-0011",
      "revision_id": "SYS-RULE-0011.r3"
    }
  ],
  "scope_id": "GLOBAL",
  "sources": [
    {
      "source_digest": "3a879614b166237db0f2137c0c9a8cbc1cd467411361792c9e451da236abcc23",
      "window_id": "WIN-00003"
    }
  ]
}
